{
  "$schema": "./spelling-policy-schema.json",
  "version": 1,
  "_meta": {
    "description": "Framework-authored text uses American English (#2978). Whole-word British -> American pairs, the spans that must keep their spelling because they are external names, and the paths the regression guard does not scan. The single word map both the guard (tests/reference/american-spelling.test.js) and minimize-helper.js spell-carry read.",
    "consumers": [
      "tests/reference/american-spelling.test.js",
      ".claude/scripts/framework/minimize-helper.js spell-carry"
    ],
    "policy": ".claude/rules/01-anti-hallucination.md (source: Assistant/Anti-Hallucination-Rules-for-Framework-Development.md)",
    "matching": "Whole word, case-insensitive; a match adjacent to a letter, digit or underscore is not a word, so camelCase and snake_case identifiers are not matched. Case is preserved on replacement: lower, Capitalized and UPPER. Any other casing is reported rather than guessed.",
    "expansion": "Every iseStems entry expands with every iseSuffixes pair (stem+british -> stem+american), except iseExceptions. Only stems whose -ize form is standard American spelling are listed: words spelled -ise in both (advise, revise, exercise, promise, surprise, expertise, compromise, …) are deliberately absent, and so is analyses, which is also the plural of analysis.",
    "identifiers": "Contract identifiers renamed by #2978. Exact, case-sensitive tokens; the guard reports any reappearance and spell-carry carries them like words."
  },
  "language": "en-US",
  "iseStems": [
    "amort",
    "anonym",
    "apolog",
    "author",
    "canonical",
    "capital",
    "categor",
    "central",
    "character",
    "commercial",
    "conceptual",
    "container",
    "contextual",
    "critic",
    "crystal",
    "custom",
    "decentral",
    "denormal",
    "depriorit",
    "deserial",
    "desynchron",
    "digit",
    "dramat",
    "econom",
    "emphas",
    "energ",
    "equal",
    "external",
    "familiar",
    "fantas",
    "fertil",
    "final",
    "formal",
    "fossil",
    "general",
    "global",
    "harmon",
    "human",
    "hypothes",
    "ideal",
    "immun",
    "individual",
    "industrial",
    "initial",
    "institutional",
    "internal",
    "international",
    "item",
    "jeopard",
    "journal",
    "legal",
    "legitim",
    "liberal",
    "local",
    "marginal",
    "material",
    "maxim",
    "memor",
    "minim",
    "mobil",
    "modern",
    "modular",
    "monopol",
    "moral",
    "natural",
    "neutral",
    "normal",
    "operational",
    "optim",
    "organ",
    "ostrac",
    "parameter",
    "patron",
    "penal",
    "personal",
    "plural",
    "popular",
    "pressur",
    "priorit",
    "random",
    "rational",
    "real",
    "recogn",
    "regular",
    "reinitial",
    "reorgan",
    "resynchron",
    "sanit",
    "scrutin",
    "sensit",
    "serial",
    "special",
    "stabil",
    "standard",
    "steril",
    "subsid",
    "summar",
    "symbol",
    "sympath",
    "synchron",
    "synthes",
    "terror",
    "theor",
    "token",
    "trivial",
    "unauthor",
    "uninitial",
    "unmaterial",
    "unrecogn",
    "util",
    "vandal",
    "vapor",
    "vector",
    "victim",
    "virtual",
    "visual"
  ],
  "iseSuffixes": [
    {
      "british": "ise",
      "american": "ize"
    },
    {
      "british": "ised",
      "american": "ized"
    },
    {
      "british": "ises",
      "american": "izes"
    },
    {
      "british": "ising",
      "american": "izing"
    },
    {
      "british": "isation",
      "american": "ization"
    },
    {
      "british": "isations",
      "american": "izations"
    },
    {
      "british": "iser",
      "american": "izer"
    },
    {
      "british": "isers",
      "american": "izers"
    },
    {
      "british": "isable",
      "american": "izable"
    }
  ],
  "iseExceptions": [
    "realiser",
    "realisers"
  ],
  "words": {
    "acknowledgement": "acknowledgment",
    "acknowledgements": "acknowledgments",
    "ageing": "aging",
    "analyse": "analyze",
    "analysed": "analyzed",
    "analyser": "analyzer",
    "analysers": "analyzers",
    "analysing": "analyzing",
    "armour": "armor",
    "artefact": "artifact",
    "artefacts": "artifacts",
    "behaviour": "behavior",
    "behavioural": "behavioral",
    "behaviourally": "behaviorally",
    "behaviours": "behaviors",
    "burnt": "burned",
    "calibre": "caliber",
    "catalogue": "catalog",
    "catalogued": "cataloged",
    "catalogues": "catalogs",
    "catalyse": "catalyze",
    "catalysed": "catalyzed",
    "centre": "center",
    "centred": "centered",
    "centres": "centers",
    "centring": "centering",
    "channelled": "channeled",
    "channelling": "channeling",
    "colour": "color",
    "coloured": "colored",
    "colourful": "colorful",
    "colouring": "coloring",
    "colours": "colors",
    "counselled": "counseled",
    "defence": "defense",
    "defences": "defenses",
    "dialled": "dialed",
    "dialling": "dialing",
    "dishonour": "dishonor",
    "dishonoured": "dishonored",
    "endeavour": "endeavor",
    "enrolment": "enrollment",
    "equalled": "equaled",
    "equalling": "equaling",
    "favour": "favor",
    "favourable": "favorable",
    "favoured": "favored",
    "favouring": "favoring",
    "favourite": "favorite",
    "favourites": "favorites",
    "favours": "favors",
    "fibre": "fiber",
    "flavour": "flavor",
    "flavours": "flavors",
    "fuelled": "fueled",
    "fuelling": "fueling",
    "fulfil": "fulfill",
    "fulfilment": "fulfillment",
    "fulfils": "fulfills",
    "funnelled": "funneled",
    "grey": "gray",
    "greys": "grays",
    "harbour": "harbor",
    "honour": "honor",
    "honourable": "honorable",
    "honoured": "honored",
    "honouring": "honoring",
    "honours": "honors",
    "humour": "humor",
    "instil": "instill",
    "jewellery": "jewelry",
    "judgement": "judgment",
    "judgements": "judgments",
    "labelled": "labeled",
    "labelling": "labeling",
    "labour": "labor",
    "learnt": "learned",
    "levelled": "leveled",
    "levelling": "leveling",
    "licence": "license",
    "licences": "licenses",
    "manoeuvre": "maneuver",
    "marshalled": "marshaled",
    "marshalling": "marshaling",
    "metre": "meter",
    "metres": "meters",
    "modelled": "modeled",
    "modeller": "modeler",
    "modellers": "modelers",
    "modelling": "modeling",
    "neighbour": "neighbor",
    "neighbouring": "neighboring",
    "neighbours": "neighbors",
    "odour": "odor",
    "offence": "offense",
    "offences": "offenses",
    "paralyse": "paralyze",
    "paralysed": "paralyzed",
    "plough": "plow",
    "practise": "practice",
    "practised": "practiced",
    "practising": "practicing",
    "pretence": "pretense",
    "programme": "program",
    "programmes": "programs",
    "relabelled": "relabeled",
    "relabelling": "relabeling",
    "remodelled": "remodeled",
    "rigour": "rigor",
    "rumour": "rumor",
    "sceptic": "skeptic",
    "sceptical": "skeptical",
    "signalled": "signaled",
    "signalling": "signaling",
    "spelt": "spelled",
    "theatre": "theater",
    "totalled": "totaled",
    "totalling": "totaling",
    "travelled": "traveled",
    "traveller": "traveler",
    "travellers": "travelers",
    "travelling": "traveling",
    "tunnelled": "tunneled",
    "tunnelling": "tunneling",
    "tyre": "tire",
    "tyres": "tires",
    "uncoloured": "uncolored",
    "unfavourable": "unfavorable",
    "unlabelled": "unlabeled",
    "vapour": "vapor",
    "whilst": "while"
  },
  "identifiers": {
    "_recognisedFormsNote": "_recognizedFormsNote",
    "labelledDirectly": "labeledDirectly",
    "recognisedForms": "recognizedForms",
    "recognisedGateTokens": "recognizedGateTokens",
    "removeMemoryArtefact": "removeMemoryArtifact",
    "writeMemoryArtefact": "writeMemoryArtifact"
  },
  "allowlist": [
    {
      "pattern": "https?://[^\\s)>\\]\"'`]+",
      "reason": "URLs are external addresses; a path segment such as ico.org.uk/for-organisations must not be respelled."
    },
    {
      "pattern": "\\bMonoBehaviour\\b",
      "reason": "Unity API type name."
    },
    {
      "pattern": "\\baria-labelledby\\b",
      "reason": "HTML attribute name."
    },
    {
      "pattern": "\\bBlue Grey\\b",
      "reason": "Material Design palette name (drawio-generation palette)."
    },
    {
      "pattern": "\\bcatalogue(?=, carts\\b)",
      "reason": "Service name in the Sock Shop microservices demo (Docs/04-Suitability/Reference-Microservices-Repos.md)."
    },
    {
      "pattern": "\\b\\d{4}-\\d{2}-\\d{2}-[a-z0-9-]*(?:parameterisation|behaviour)\\.md\\b",
      "reason": "Record filenames under Construction/Design-Decisions/ keep the spelling they were committed with; a reference to one must still resolve."
    },
    {
      "pattern": "Unrecognised argument --bogus",
      "reason": "Recorded expected output of charter-testing-audit.js in the v0.103.0 release test plan; a record keeps what the tool printed then."
    },
    {
      "pattern": "\\[x\\] catalogued|`catalogued` with `checked:true`",
      "reason": "Recorded command input and expected output in the v0.97.0 release test plan (G2)."
    },
    {
      "pattern": "How to Organise Feature Files",
      "reason": "Title of a third-party page (Cucumber blog), quoted as written."
    },
    {
      "pattern": "\"british\": \"[A-Za-z]+\"",
      "reason": "The word a spell-carry replaced, recorded in minimize-records.json spellCarry substitutions (#2984; moved there from minimize-targets.json by #3326). A British spelling is the value's whole purpose: the verifier applies these in reverse to reconstruct the pre-carry file. Scoped to the JSON field, so ordinary prose in that file is still guarded."
    }
  ],
  "excludePaths": [
    {
      "glob": ".claude/metadata/spelling-policy.json",